date,rating,res_id,res_name,rev_count,rev_id,rev_name,text,sentiment
17/03/2019 22:18,Rated 5.0,18716525,Aura Cafe,"153 Reviews , 250 Followers",1226687,Hussain Abbas,RATED  Aura has to be my Beautiful Breakfast places #1 in the city.Literally never had a cheese omelette anywhere else like the one at Aura. Love a great Mocha with my breakfast and they make my coffee just as I like it. Delicious waffles and pancakes too.Will be visiting very frequently and try out some of their famous burgers and pastas as well.,Positive
16/03/2019 21:25,Rated 3.0,18716525,Aura Cafe,"33 Reviews , 86 Followers",27912218,Sunakshi Gupta,"RATED  A decent place to come over for chit chat. Staff is polite and quite familiar with the menu. Pizza was tender with soft dough, felt Ingredients were so farm fresh. Overall Rating :Food- 4/5Staff-4/5Ambiance-4/5Value for money-3.5/5Find their signature Burger attached!",Neutral
16/03/2019 10:18,Rated 4.0,18716525,Aura Cafe,"41 Reviews , 200 Followers",38270346,Bhavya Thamban,"RATED  Everything is good about this place except price. Food is damn expensive. But even if it's expensive it's worth a visit though. Try pizza, it's really good.",Positive
14/03/2019 09:13,Rated 5.0,18716525,Aura Cafe,"49 Reviews , 500 Followers",39225454,Lovely Sharma,"RATED  Aura Cafe has a good ambiance with outdoor sitting mingles will good yummy food n service, my friend used Zomato gold, so couple of dishes were complimentary.",Positive
12/03/2019 09:44,Rated 3.0,18716525,Aura Cafe,"306 Reviews , 1974 Followers",553112,Raghav Peddi 'The Food Shaukeen',,Neutral
12/03/2019 04:56,Rated 4.0,18716525,Aura Cafe,"32 Reviews , 345 Followers",740280,Srayana Sanyal,"RATED  Aura Cafe is the perfect place for a Sunday brunch. I love the cozy, fresh vibe. Their staff is really courteous and humble. The service is timely. As far as the food goes, their proportions are great and not exorbitantly priced. The presentation of food isn’t consistent across dishes though. The only complaint I have is about the lack of enough ham and eggs not being runny in the Benedict.Overall, a great place in Hyderabad!",Positive
10/03/2019 12:18,Rated 5.0,18716525,Aura Cafe,"75 Posts , 1472 Followers",1526181,Swati Nandy,RATED  In case you are wondering I am talking about Aura Cafe that is located in Jubilee Hills. We were invited here for a food tasting table. We started off with the Desi Mojito. This was a combination of jaljeera and mint. The Mango Cucumber Mule had the fresh flavors of cucumber and mint and is the perfect summer drink. ...Read full post on thegastronomictale.wordpress.com,Neutral
09/03/2019 22:26,Rated 5.0,18716525,Aura Cafe,"24 Reviews , 70 Followers",30771454,Swasti Sinha,"RATED  Aura cafe was on my bucket list from long and we used Zomato Gold here.The entry of the cafe is through the good organic food counters which advertises all healthy organic products.The cafe has that warm, bright , classy texture that adds to its name and ambience.Coming to the food we ordered charcoaled prawns in starters . The presentation of the food here is great.In mains we ordered a chicken burger and Quattro formaggi in mains. Special mention for the freshly baked thin crust of the pizza they serve. We ordered the baby pink coffee which was consist of raspberry cream and coffee . A new combination but definitely worth trying.In dessert it was a simple scoop of chocolate icecream which was complimentary and tastes good.Food -5/5Ambience-5/5Service-5/5",Positive
09/03/2019 19:46,Rated 5.0,18716525,Aura Cafe,"343 Reviews , 3978 Followers",15102371,Asad Rana,,Negative
09/03/2019 10:14,Rated 5.0,18716525,Aura Cafe,"71 Reviews , 304 Followers",2721394,Snehasish Behera,,Neutral
07/03/2019 11:22,Rated 2.0,18716525,Aura Cafe,"79 Reviews , 132 Followers",33219423,Sunil Prajapat,,Positive
07/03/2019 01:56,Rated 5.0,18716525,Aura Cafe,"35 Reviews , 13 Followers",53600719,Kaunain,"RATED  Okay I'm obsessed with aura cafe. I lovedddd what not the service, food, quality, quantity, ambiance everything was on point a legit 5/5A musttttr visit. Its a very multipurpose cafe with a organic supermarket having an amazing variety of veggies and healthy alternatives.I ordered chicken teriyaki wings, chicken piccata, chicken pesto pasta and a cakeEverything was perfect 💕A little bit on the pricey side but worth every penny.",Positive
04/03/2019 20:59,Rated 4.0,18716525,Aura Cafe,"17 Reviews , 43 Followers",16151274,Rithvik,"RATED  A nice place to hangout and meet old friendsPeaceful and environment friendly ambienceHealthy and good food, Although the quantity could have been a bit more considering the value for money.",Positive
02/03/2019 07:09,Rated 4.0,18716525,Aura Cafe,"114 Reviews , 404 Followers",32732516,Karpurmanjari Kakati,"RATED  This was a long time plan to visit Aura Cafe. Mainly because of the fancy and unique menu they had.Finally here for dinner.The entrance to the Cafe is such refreshing and colorful with imported fruits and berries.Seemed little over priced but they really worked well for the ambience.Loved the retail outlet. And few steps further they have the seating area for the Cafe.We organized place.Ordered a soup, which I just lived a lot. The best I ever had, Tomkha Gai it is.Had chicken pizza. Honestly, I didn't quite like the pizza. Just not living upto the standard of Cafe I feel.Also order chicken tetriota. It was good. I liked the chutney a lot.Over all great refreshing dinner.Would definitely visit soon for exploring more.",Positive
28/02/2019 23:43,Rated 5.0,18716525,Aura Cafe,"77 Reviews , 140 Followers",48372980,Karishma Bhatt,"RATED  Loved it !! I visited this place after seeing reviews on Zomato. The experience was amazing. I ordered Chicken pizza which was spicy which i loved, spinach sandwich , chicken salad, one chicken starter named chicken teriyaki which is a must try . The ambience and the food presentation is very unique. The service is also very impresive. The waiters were very humble and polite and the best part was our order came to our table very quickely. We Received one 500 coupon also as part of their promotion.Food - 5/5Ambience - 5/5Price - 5/5Service and hospitality - 5/5",Positive
28/02/2019 21:44,Rated 4.0,18716525,Aura Cafe,"26 Reviews , 72 Followers",29323884,Arjun Semwal,"RATED  This place is heaven for you if you love pasta. So much of mouth watering. Every ingredient was so balanced. I liked it.Aura fizz and mango lagoon drinks was so beautiful to see and amazing when tasted.Suggestions: Need to work on pizaa.. everything was on the pizza base but still I felt something is not meeting the expectation, it really did not touch my taste.Ambiance is cool, It has inside and outside sitting. Management is very humble.Will visit you soon, do not forget to work on pizza.",Positive
25/02/2019 03:02,Rated 4.0,18716525,Aura Cafe,"21 Reviews , 19 Followers",2862990,Abhishek Kolpuru,"RATED  This place has an amazing ambience and it also indoor and outdoor seating. We ordered cheese cigars,cold coffee , virgin mojito,pizza, chicken Alfredo pasta and combo of desserts.Food here is well presented and tasted amazing. It's quite expensive when compared to others",Positive
23/02/2019 17:03,Rated 4.0,18716525,Aura Cafe,"65 Reviews , 280 Followers",47176946,Sonalika Reddy,"RATED  I loved the ambience of this place and the fact that all sorts of gourmet condiments and packaged food are available ,this was a mini supermarket which sells organic veggies and fruits . Coming to the food I was very disappointed one thing I liked was the presentation of food which made it seem very delicious contrary to the actual taste , I think I'll have to give it another try before I can actually make up my mind , overall we can visit this place",Positive
20/02/2019 10:28,Rated 4.0,18716525,Aura Cafe,"29 Reviews , 29 Followers",27214783,C Shubha,,Neutral
19/02/2019 19:35,Rated 5.0,18716525,Aura Cafe,"53 Reviews , 77 Followers",1686396,Ankit Raj Garg,RATED  Amazing place with an awesome quality of food. The ambience is good lile a cute place. Not too much of glittering but a great place to have a peaceful lunch/dinner. I recommend this place.,Positive
18/02/2019 08:31,Rated 5.0,18716525,Aura Cafe,"23 Reviews , 63 Followers",1495021,Abhinaya Talasila,"RATED  Ambience is just a wow! The dessert platter, hot chocolate and cheese garlic bread was our order and everything tasted so delicious.Ambience : 5/5Food : 4.5/5Value for Money : 4/5",Neutral
16/02/2019 13:15,Rated 5.0,18716525,Aura Cafe,"48 Reviews , 135 Followers",27632677,Roshni Aftab,"RATED  I have been here a couple of times and each time it has been a lovely experience.The first thing that strikes you is the ambience of this amazing place. It has both indoor and outdoor seating arrangements, both of them are lovely.Coming to the food, it is amazing. Their pizza as they claim are really the best in town. In fact, it is so much better than the other self acclaimed pizza chains in India. Whenever I am having a pizza craving in the future, I am definitely coming to Aura. We also had pasta and burger , both of them are delicious and worth a try.The service is also up top and I have used zomato gold service here without any hassles.Coming to the prices of the food , they might seem a bit high but it is worth the price. And with zomato gold, you can always avail a 1+1 offer on food.My verdict : When in Hyderabad and you need a place to chill with your gang, this is the place to be.",Positive
16/02/2019 09:31,Rated 3.0,18716525,Aura Cafe,"34 Reviews , 113 Followers",3902771,Vikas Chaitanya,RATED  Been here with a friend. Place was really good to look at. ambience is good. Yet you feel something is missing. Staff was courteous and service was good. When I paid through Dineout I was asked to pay the discount I got through it cos they have some random rule which I have never faced in any other restaurants.,Positive
13/02/2019 03:25,Rated 5.0,18716525,Aura Cafe,"55 Reviews , 112 Followers",299978,Uday Kanth,,Neutral
11/02/2019 11:09,Rated 4.0,18716525,Aura Cafe,"100 Reviews , 2216 Followers",986804,Full_on_food,,Positive
10/02/2019 17:35,Rated 5.0,18716525,Aura Cafe,"198 Reviews , 473 Followers",31535308,Eat Like Jo 👨🏻‍🍳,,Negative
10/02/2019 16:47,Rated 4.0,18716525,Aura Cafe,"43 Reviews , 137 Followers",2115246,Sejal Agarwal,"RATED  Tried their breakfast menu. Ordered one portion of American Breakfast and Masala omelette each. The American breakfast includes fried / scrambled/ poached eggs with bread, sausages, bacon, muesli, pancakes and tea / coffee. The portion is good and filling. The bread seems freshly baked and the pancakes were so soft that they just melted in the mouth. Cappuccino is again, very good. They have multiple options for green tea. Do try their Kadak chai, they add kesar to it!",Positive
10/02/2019 16:33,Rated 5.0,18716525,Aura Cafe,"41 Reviews , 116 Followers",71683,Subhasis Saha,"RATED  Friend’s recommendation. Thank you!!! Amazing place with very helpful staffs. Like the ambience and the setting. Good spread and good range of desserts!!! Will recommend everyone who is looking for a nice, relaxed Sunday Brunch or Lunch!!!",Positive
09/02/2019 12:36,Rated 5.0,18716525,Aura Cafe,"48 Reviews , 108 Followers",36487248,Srikar,RATED  There is no surprise Aura had been awarded with Times Best FoodEvery food item in the menu is made with perfect combination of hot and spiceSome items are little high priced and I expect some more food in the Desert MenuOther than this everything is perfectWill do visit again,Positive
09/02/2019 02:07,Rated 4.0,18716525,Aura Cafe,"146 Reviews , 3558 Followers",15569913,Samia_foodie,RATED  We heard so much about the famous gulab jamun cheesecake from this place that I had to try it.. and I must say it was really nice although the base wasn’t that perfect. The breakfast platter was good too. The pancakes & the burger were pretty ok. The garlic bread was nice & spicy. The ambience of the cafe is pretty relaxing & definitely a good hang spot.,Positive
08/02/2019 12:08,Rated 5.0,18716525,Aura Cafe,"107 Reviews , 1504 Followers",86715,Mehul Ashar,RATED  This one is a hidden gem! It was suggested by a friend and I have now become a regular here. The potato skins are amazing and so is the service. The ambience is casual and the place is really refreshing.They could have had a separate entrance to the restaurant since its a bit confusing for first timers as you need to go through the store to get into the restaurant. Though they have the staff to guide you. It's an all-day dining affair so you can go for a lazy lunch or a hi-tea with friends and family. Make sure to try the hot chocolate. One of the best I have had.,Neutral
05/02/2019 00:44,Rated 5.0,18716525,Aura Cafe,"23 Reviews , 243 Followers",2200258,Ryan DSilva,RATED  The food is excellent here. The truffle flavoured wild mushroom soup is just perfect to warm you up on a chilly winter evening. The cheesy beetroot salad is one of the best that I have had in a long time. The chicken burger was good. Great deserts and sorbets. Attentive service. It’s has a nice little gourmet store attached to the restaurant with some good organic offerings that you can pick up on your way out.,Positive
04/02/2019 07:49,Rated 4.0,18716525,Aura Cafe,"45 Reviews , 21 Followers",47577998,Akhil,"RATED  *BREAKFAST REVIEW*The ambience of this place is very peaceful and welcoming. One could stay here for hours and not get bored.The food is pretty decent too. They've gotten the basics right. Nothing extraordinary or extravagant per se.The waffles and pancakes had the right amount of sweetness and were light yet fluffy.Eggs Benedict- this dish sorta blew me away with its taste and flavour.The muesli jar we ordered had a refreshing taste.My friends' aura non veg sandwich apparently was a little on the bad side as the bread was dry and hard.Otherwise, the experience was a tad overpriced for regular breakfast but decent nonethelessOverallAmbience- 5/5Food - 4/5Value for money - 3/5Service- 5/5Would I go back again ? Maybe.",Positive
02/02/2019 21:22,Rated 4.0,18716525,Aura Cafe,"21 Reviews , 288 Followers",1030935,Yasmin Ara,"RATED  The place will hit u by surprise,apart from a cafe it has an exotic inbuilt supermarket with all exotic fruits n vegetables. The food is amazing and the homemade ice cream are worth every lick. (My personal fav mix berry sorbet).",Positive
02/02/2019 00:49,Rated 4.0,18716525,Aura Cafe,"29 Reviews , 31 Followers",430522,Aditya Ponugonti,"RATED  Visited the place with high expectations, but it was just about ok. The four stars is only for the lamb shank. Felt overpriced but zomato gold to the rescue ;)",Positive
01/02/2019 16:29,Rated 3.0,18716525,Aura Cafe,"71 Reviews , 111 Followers",35422959,Yash Barmecha,RATED  It is not really a great place in terms of the food they serve. It can be way better. There are better ones which serve better food at a lesser price while not hampering the quality of food.,Positive
31/01/2019 18:39,Rated 5.0,18716525,Aura Cafe,"24 Reviews , 172 Followers",1468995,Adrita Khaund,"RATED  A beautiful place for a quiet lovely evening. Had a great time with my husband over a coffee and risotto and chicken teriyaki.. Nice presentation and good FRESH food. I would definitely come back again to try other dishes on the menu. The aura Cafe spreads positive, peaceful aura..",Positive
31/01/2019 18:25,Rated 5.0,18716525,Aura Cafe,"178 Reviews , 1468 Followers",1351980,Dinesh,"RATED  Been to this place a few times and it never disappointed, be it food or the service. It has to be one of those places, that you fall in love with, right on your first visit. The seating space has three different zones to choose from, based on your preferences. The kind off ingredients they use, are fresh and great quality. Staff does always help you out with the menu to order. Of all the stuff that i tried at this place, my personal favorite has always been Spanish Bombon! A place totally worth visiting again and again!Ps: Pics do the talking! :)",Positive
30/01/2019 17:26,Rated 4.0,18716525,Aura Cafe,"166 Reviews , 370 Followers",2820490,Mrunal Ganti,"RATED  Lovely place , great ambience. Nice food. Tried contadina pizzas n stuffed potato food was good. Service was really quick n friendly service",Positive
29/01/2019 18:43,Rated 4.0,18716525,Aura Cafe,"17 Reviews , 200 Followers",2313440,Vidya Sivalenka,"RATED  What a lovely place, this! Their menu is really interesting with unique flavors and has good options for veg too. Do try the soups, they're yum! Slightly pricey hence the 4 stars, else it's definitely a 5! :) also do check out the store they have attached to the place, has some exotic fruits and veggies.",Positive
26/01/2019 21:40,Rated 5.0,18716525,Aura Cafe,"64 Reviews , 60 Followers",35040727,Gourmetlove,"RATED  A very beautiful and cosy breakfast place, with cool interiors. They have a lot of American and continental breakfast options. We went to have a casual coffee meet up and it was heavenly. Tasted the quatro formaggi pizza and the veg burger. They were very rich and nicely prepared and i can easily give that a 5 .",Positive
26/01/2019 19:06,Rated 3.0,18716525,Aura Cafe,"41 Reviews , 138 Followers",37248917,Hephzibah Smith,RATED  So we headed here on a recommendation and we ordered the teriyaki and spicy calamari the presentation was beautiful the teriyaki wasn't really bad if u are just wanting to give credits to the presentation u can give this one a 10/10 the calamari wasn't really great it was sweet and reminded me of the chutney they serve in pani puri the ambience is really nice,Positive
26/01/2019 14:53,Rated 2.0,18716525,Aura Cafe,"57 Reviews , 320 Followers",31405882,Sneha,RATED  The food is extremely good! But the service is bad. The waiters are rude and they got wrong orders 5 times! They never bothered to apologise and started arguing with us even though we were trying to be as kind as possible. It’s sad that the chefs cook up a storm but the waiters ruin your experience. Extremely sad. It’s written in the menu to ask a waiter about desserts and when asked he just rudely asked us to get up and see the desserts on display by ourselves. I will never enter this place.,Negative
26/01/2019 14:22,Rated 3.0,18716525,Aura Cafe,"65 Reviews , 1873 Followers",853534,Nitish Vasav,,Positive
25/01/2019 00:11,Rated 5.0,18716525,Aura Cafe,"20 Reviews , 9 Followers",42686969,Alisha,RATED  This was a feel good cafe with great pizzas and ambience 🍀🌼 Gonna visit again ✅Staff was politeLovely ambienceYummy foodMocktails were great,Positive
22/01/2019 23:38,Rated 5.0,18716525,Aura Cafe,"46 Reviews , 499 Followers",705723,Harsh Jaju,RATED  Great food! Friendly staff. Shout out to our server Gunjan who took great care of us. The mushroom soup is a must-try! Nice fancy store attached to it as well!,Positive
19/01/2019 23:29,Rated 4.0,18716525,Aura Cafe,"22 Reviews , 24 Followers",35442716,Vikash Upadhyay,"RATED  Heard good reviews about this place so decided to give It a try. I must say the reviews were right,This is a great place. The food is tasteful and the service is awesome. Order Tom Khai soup and mutton dhansak. Both the dishes were very tasty, the quantity for dhansak could have been little more though. Also, if you are a coffee lover then you should try the coffee here. Overall, we had a great experience and would visit this place again.",Positive
18/01/2019 18:16,Rated 4.0,18716525,Aura Cafe,"219 Reviews , 1854 Followers",1484925,Anusha Punjala,,Neutral
18/01/2019 17:16,Rated 5.0,18716525,Aura Cafe,"65 Reviews , 811 Followers",50417898,Sneha Battula,"RATED  Discovered this place today and I'm super happy with the Food, quality, ambience and service. Has a large variety of American breakfast options and they are super healthy. The ambience is really pretty and cosy and perfect for a brunch.",Positive
17/01/2019 17:17,Rated 4.0,18716525,Aura Cafe,"128 Reviews , 229 Followers",37401226,Praneetha Dundigalla,"RATED  This is a place that you could have dinner or lunch or just hangout with your friends. The service and F&B is quite curteous and friendly as well. Also, they have a store right next to it which I personally loved as they have all the exotic ingredients and I'm sure vegans would love this.Coming to the important part i.e, food 😋I've tried Baby Pink And Coconut Almond smoothie (Vanilla) in beverages. Baby pink was okay but not great. It was berry crush layered with coffee and cream. However, I loved the smoothie. would definitely recommend it. It had a refreshing taste.Also, I tried their pizza - Contadina which I absolutely loved. I can say it's one of the best pizzas I've had in town. Next was the Aura club sandwich (non veg) - this had a multi grain bread with layers of coleslaw, egg, Mayo and turkey which was yum and was served with fried of course.",Positive
17/01/2019 14:22,Rated 4.0,18716525,Aura Cafe,"168 Reviews , 1731 Followers",1334924,Rajani P,"RATED  A really beautiful place tucked in the bylanes of Jubilee Hills. Had a beet root salad, butternut squash risotto and Vietnamese curry leaf Basa with coconut rice. Loved the food and the presentation as well. The menu looked really interesting as well. Will come back to try more!Bhargavi",Positive
16/01/2019 16:13,Rated 4.0,18716525,Aura Cafe,"37 Reviews , 110 Followers",416536,Abrit,,Neutral
15/01/2019 10:50,Rated 5.0,18716525,Aura Cafe,"67 Reviews , 1347 Followers",37111569,Priyal Jain,"RATED  I really really liked the food, but I'd give it a 4.5 if possible. I just expected more from the egg Benedict platter. But the pancakes and the coffee was all beautiful I was so pleased. Service as well. 10/10.",Positive
15/01/2019 00:17,Rated 3.0,18716525,Aura Cafe,"27 Reviews , 66 Followers",34715433,Dinakar CV,"RATED  No doubt the cafe is really good by its look and all but I personally didn’t like the food that much . The ambience , aesthetic interiors were too good .We’ve ordered chicken teriyaki , chicken croquettes, aura fizz and Oreo cold coffee !Presentation and all was on point but coming to the price I’m paying for the dish quantity was way too less ! Bit more of balancing between the price and dish would’ve been great !",Positive
13/01/2019 21:09,Rated 5.0,18716525,Aura Cafe,,804516,,,Neutral
13/01/2019 14:11,Rated 4.0,18716525,Aura Cafe,,990918,,,Neutral
10/01/2019 20:41,Rated 4.0,18716525,Aura Cafe,,1564740,,,Neutral
08/01/2019 00:45,Rated 5.0,18716525,Aura Cafe,,1974278,,,Neutral
07/01/2019 18:25,Rated 4.0,18716525,Aura Cafe,,68128143,,,Negative
07/01/2019 16:07,Rated 5.0,18716525,Aura Cafe,,2988902,,,Neutral
07/01/2019 14:27,Rated 4.0,18716525,Aura Cafe,,1577734,,,Neutral
05/01/2019 23:20,Rated 5.0,18716525,Aura Cafe,,38060246,,,Neutral
05/01/2019 18:23,Rated 5.0,18716525,Aura Cafe,,129971,,,Neutral
03/01/2019 15:21,Rated 4.0,18716525,Aura Cafe,,1834368,,,Neutral
01/01/2019 08:59,Rated 5.0,18716525,Aura Cafe,,43309790,,,Neutral
31/12/2018 23:58,Rated 4.0,18716525,Aura Cafe,,3134148,,,Neutral
31/12/2018 23:51,Rated 5.0,18716525,Aura Cafe,,1460146,,,Neutral
31/12/2018 11:15,Rated 5.0,18716525,Aura Cafe,,31399125,,,Neutral
30/12/2018 19:42,Rated 3.0,18716525,Aura Cafe,,36070774,,,Neutral
30/12/2018 15:00,Rated 5.0,18716525,Aura Cafe,,1891412,,,Neutral
29/12/2018 09:37,Rated 5.0,18716525,Aura Cafe,,132137,,,Neutral
28/12/2018 00:19,Rated 4.0,18716525,Aura Cafe,,125714,,,Negative
27/12/2018 21:59,Rated 4.0,18716525,Aura Cafe,,894969,,,Neutral
27/12/2018 05:57,Rated 4.0,18716525,Aura Cafe,,1889724,,,Neutral
27/12/2018 02:26,Rated 5.0,18716525,Aura Cafe,,15416931,,,Neutral
26/12/2018 11:17,Rated 5.0,18716525,Aura Cafe,,38886625,,,Negative
24/12/2018 20:32,Rated 4.0,18716525,Aura Cafe,,405448,,,Neutral
23/12/2018 23:35,Rated 5.0,18716525,Aura Cafe,,573349,,,Neutral
23/12/2018 21:52,Rated 5.0,18716525,Aura Cafe,,1700577,,,Neutral
19/12/2018 20:42,Rated 4.0,18716525,Aura Cafe,,38037044,,,Neutral
19/12/2018 20:16,Rated 3.0,18716525,Aura Cafe,,27116308,,,Negative
16/12/2018 23:13,Rated 3.0,18716525,Aura Cafe,,36499818,,,Neutral
14/12/2018 18:03,Rated 5.0,18716525,Aura Cafe,,1299139,,,Neutral
12/12/2018 22:47,Rated 4.0,18716525,Aura Cafe,,31698847,,,Neutral
12/12/2018 19:00,Rated 5.0,18716525,Aura Cafe,,1343391,,,Neutral
10/12/2018 00:40,Rated 4.0,18716525,Aura Cafe,,41823838,,,Negative
09/12/2018 23:01,Rated 4.0,18716525,Aura Cafe,,38021566,,,Neutral
07/12/2018 11:58,Rated 4.0,18716525,Aura Cafe,,31548183,,,Neutral
05/12/2018 12:03,Rated 3.0,18716525,Aura Cafe,,1540250,,,Neutral
05/12/2018 09:23,Rated 3.0,18716525,Aura Cafe,,1140447,,,Neutral
05/12/2018 00:30,Rated 5.0,18716525,Aura Cafe,,16708534,,,Neutral
04/12/2018 19:45,Rated 4.0,18716525,Aura Cafe,,1903260,,,Negative
04/12/2018 17:33,Rated 5.0,18716525,Aura Cafe,,1272449,,,Neutral
02/12/2018 20:51,Rated 4.0,18716525,Aura Cafe,,367779,,,Neutral
01/12/2018 21:17,Rated 3.0,18716525,Aura Cafe,,58439706,,,Neutral
01/12/2018 17:46,Rated 4.0,18716525,Aura Cafe,,50547156,,,Neutral
30/11/2018 21:58,Rated 3.0,18716525,Aura Cafe,,15682988,,,Neutral
30/11/2018 18:30,Rated 4.0,18716525,Aura Cafe,,11705481,,,Neutral
30/11/2018 08:38,Rated 5.0,18716525,Aura Cafe,,1273870,,,Neutral
29/11/2018 12:13,Rated 4.0,18716525,Aura Cafe,,33475556,,,Neutral
29/11/2018 10:27,Rated 5.0,18716525,Aura Cafe,,3593221,,,Neutral
26/11/2018 20:13,Rated 4.0,18716525,Aura Cafe,,30208267,,,Neutral
26/11/2018 15:31,Rated 5.0,18716525,Aura Cafe,,1375070,,,Neutral
25/11/2018 19:13,Rated 4.0,18716525,Aura Cafe,,1853730,,,Neutral
25/11/2018 15:28,Rated 3.0,18716525,Aura Cafe,,27946284,,,Neutral
24/11/2018 16:34,Rated 4.0,18716525,Aura Cafe,,38049215,,,Neutral
22/11/2018 21:47,Rated 4.0,18716525,Aura Cafe,,4697481,,,Negative
21/11/2018 07:41,Rated 4.0,18716525,Aura Cafe,,50113671,,,Neutral
19/11/2018 18:17,Rated 3.0,18716525,Aura Cafe,,43320501,,,Neutral
18/11/2018 15:18,Rated 5.0,18716525,Aura Cafe,,1323784,,,Neutral
17/11/2018 20:58,Rated 5.0,18716525,Aura Cafe,,4084471,,,Neutral
