date,rating,res_id,res_name,rev_count,rev_id,rev_name,text,sentiment
16/01/2019 22:01,Rated 5.0,18888425,Feranoz Pâtisserie & Cafè,"94 Reviews , 455 Followers",46383732,Tornadointhekitchen,,Neutral
16/01/2019 18:03,Rated 5.0,18888425,Feranoz Pâtisserie & Cafè,"219 Reviews , 1854 Followers",1484925,Anusha Punjala,,Neutral
13/01/2019 14:32,Rated 5.0,18888425,Feranoz Pâtisserie & Cafè,"247 Reviews , 3982 Followers",585547,Hyderabadfoodexplorer (sanchay Gumidelli),,Neutral
12/01/2019 20:55,Rated 5.0,18888425,Feranoz Pâtisserie & Cafè,"143 Reviews , 1100 Followers",15416931,Junaid Aziz,,Positive
11/01/2019 23:49,Rated 4.5,18888425,Feranoz Pâtisserie & Cafè,"238 Reviews , 3209 Followers",33376100,_thefoodtrip_,,Neutral
24/12/2018 16:22,Rated 5.0,18888425,Feranoz Pâtisserie & Cafè,"86 Reviews , 146 Followers",510460,Saikrishna Pothuri,"RATED  The ambience and the way they are receiving their customers is really nice! We have tried their Opera, Rocher, Madvik, Red Velvet Cupcake & Rosso. All of them were amazing! Would surely recommend all the dessert lovers to go here. A great competition to Concu. If they increase the size of the pastries it would be great!",Negative
09/12/2018 20:07,Rated 5.0,18888425,Feranoz Pâtisserie & Cafè,"31 Reviews , 105 Followers",42809497,Asad Khan,"RATED  You will love Feranoz If you are fan of Ferrero Rocher and cant get enough of it in that tiny piece of chocolate, then welcome the hugh Rocher (must have).Coffee lovers would love the Tiramisu and if you are a cheese cake lover then the blueberry cheesecake should be your preference.The calm Ambiance is a great hangout spot to have a meet up or simply to de stress yourself along with the Exotic Tea's ( Mountain Rose to be precise).",Positive
16/03/2019 13:21,Rated 4.0,18807262,Broadway,"92 Reviews , 588 Followers",43673663,Ramya Ponnada,"RATED  Well! Broadway may be famous for being a brewery. But, it offers an equally good fine dining experience.It has got a nice Classy Ambience and decent Service.Coming to food, tried Jalapeño poppers, paneer tikka and potato wedges for starters. Wedges were crispy and slightly spicy, Paneer tikka is amazingly presented and tastes good too. But the star was Jalapeño poppers. Super delicious. 😋Then in the main course, tried veg pizza and veg soft noodles. Pizza was perfect with a thin and crispy base.Noodles was served with assorted vegetables in chilly garlic sauce, and it was simply lip smacking!!!Finally, the only thing I wasn't satisfied with is their value for money. Found it a bit over pricey. Otherwise, it's a been a good experience.My Suggestion: Worth a try!",Positive
11/03/2019 11:25,Rated 4.0,18807262,Broadway,"42 Reviews , 200 Followers",1555655,Karthik Valvekar,"RATED  Word of mouth - got to know the pizza and ambience is great and place is huge.. not disappointed- great service when you sit by the bar.. good mix of cocktails, mocktails and brewery is good as well. Will visit again!!!",Neutral
10/03/2019 20:10,Rated 5.0,18807262,Broadway,"75 Reviews , 190 Followers",16064718,Manish Yadav,"RATED  Broadway is located on the Road no 46 Jubilee hills. I would say that it is one of the happening places in Hyderabad.They brew a wide variety of beers along side regular bar menu.Also a large menu of continental and Indian cuisine.I was here with my friends. Had their white rabbit beer which was light and a bit on the sweeter side. I liked it.We also tried tequila with lemon, kamikaze shot, broadway mule they also were quite good. For sides we had fish fingers, chicken popcorn, prawns and Quesadilla and also chicken kebabs.All these tasted too good.This is the only microbrewery which serves the best food along with best beers. Hands-down. 🤙🤙🤙",Positive
08/03/2019 20:14,Rated 5.0,18807262,Broadway,"105 Reviews , 653 Followers",15672861,Rupesh Singh,"RATED  Have been to this place many times. And never been disappointed.The place is really huge , i guess biggest pub in terms of space and capacity. Options for indoor as well as outdoor sitting. The place remains full during weekends.The brewery is good although i would not say it as the best. wheat beer and stout is good.Inspite of huge crowd , the sevice is goodThe food quality is very good. We have tried its nachos, french fries, paneer bhurji pav, kebabs etc. Everything is will prepared.All the above combined with great music makes it a perfect place to be. Special mention to their saturday night DJ . He is just amazing may be best in town.overall a great place",Positive
02/03/2019 15:56,Rated 4.0,18807262,Broadway,"61 Reviews , 247 Followers",3219999,Shreyaaaaaaa,"RATED  This place has really good ambience along with great music. Coming to the food, i’ve tried butter chicken pasta, veg alfredo pasta and vodka primera pasta, cheese balls, gunpowder fried chicken, crème brûlée and gooey chocolate cake.The vodka primera pasta is easily one of the best pastas i’ve ever had- so flavorful, with the right cheese to sauce ratio. The gunpowder chicken was too spicy for my liking but tastes good. Butter chicken pasta sounded interesting but wasn’t upto the mark. I really liked both the desserts too- crème brûlée is a must try!overall a really good place with an amazing vibe to it.food-4/5ambience-5/5service-3/5",Positive
28/02/2019 23:24,Rated 3.0,18807262,Broadway,"21 Reviews , 177 Followers",40477318,Jaya Prakash,"RATED  Decent restaurant, beer also decent nothing of extra ordinary. All beers where not available at time we visited place. Ambience was highlights",Positive
25/02/2019 20:57,Rated 4.0,18807262,Broadway,"22 Reviews , 133 Followers",192218,Ruby Singh,"RATED  I was looking to visit a new brewery and that's when I discovered Broadway. I totally loved the food and ambience. I found the in-house beer a little bit on the expensive side but it won't drill a hole in your pocket. They have inside and outdoor seating and both are totally worth the money that you spend. I ordered a pizza and beer and I totally loved the food. The beers seem to a little bland as compared to other breweries that I have been but not that bad.Thr staff is patient and the waiting time is also very less. The place is totally instaworthy, in case you are an insta addict this place a lot of options to invigorate the photographer inside you.I recommend this place for good food and great ambience.",Negative
22/02/2019 14:50,Rated 5.0,18807262,Broadway,"23 Reviews , 882 Followers",34859559,Gargi Mehrotra,"RATED  Yesterday’s dinner😍•In frame:Coriander Chicken, spring rolls, fish fingers, mocktails, grilled broccoli, prawns, chicken platter, panacota (dessert) 😋, veg kabab😍",Neutral
17/02/2019 04:43,Rated 4.0,18807262,Broadway,"104 Reviews , 2622 Followers",36167527,Kamal Sardiwal,"RATED  I've been here a week ago. Eat, drink and rejoice with live music at Broadway The Brewery. One of the finest breweries in Hyderabad, located at Road 46/A, Jubilee Hills. Offers valet parking service. The place is humongous and can accommodate over 200 people. Its interiors are beautifully built with highly appealing ambience.Decent Appetizers: Spinach & cheese fatayer, cheese balls, Manglorean mamsum ghee roast, Coriander chicken, Cheese cigars, Spinach & cheese fatayer, and Onion rings.Yummy Mains: Chicken grilled sandwich, Butter chicken pasta and Paneer tikka pizza with a feeter base.Mocktails to be tried: Virgin bloody Mary and Watermelon Mojito.Cocktails: Southside, Bullfrog, Raw Mangotini, Tequila m melon, Chocolate martini, Southside, Bullfrog, and Dr PrescriptionDesserts served: Matka kulfi, Pannacotta, Blueberry cheesecake, and Gooey chocolate cakeBest desserts of all: Blueberry cheesecakeWaiters are readily available at your service.instagram.com",Positive
16/02/2019 14:47,Rated 4.0,18807262,Broadway,"22 Reviews , 26 Followers",44078597,Sagar Chand Agarwal,"RATED  One of the new places in Hyderabad and brewery above the floor, perfecto. I went with my friends on my birthday and the place did perfect justice. Coming to ambience, the music was loud inside but if you go to outer area, it is quiet. Service was late. Food wise, starters top the chart , especially onion rings and fries. Presentation wise food was nice. I recommend the place for visit once. Price wise it was expensive.",Positive
14/02/2019 16:04,Rated 5.0,18807262,Broadway,"31 Reviews , 47 Followers",40450481,Niyathi Kosuri,"RATED  I tried the paneer Tikka pizza, chicken spaghetti Alfredo, mojito,the Broadway refreshing drink, mango coloda, potato wedges and onion rings.Pretty huge portions there was leftover food, 3 of us went.The pizza is a MUST TRY.ITS BLISSFUL.I've rarely had such great pizza, it's around 650 rupees but it's a full Paisa vassol deal. Totally worth the money, the taxes are very high because it's a brewery but other than that there are no complains, the staff is super polite.The ambience is breathtaking, just beautiful, boho chicish.People must visit.",Positive
05/02/2019 19:24,Rated 5.0,18807262,Broadway,"23 Reviews , 26 Followers",15690539,Sreeteja Reddy Mandadi,"RATED  Loved how huge the place is and the versatile seating it had. The staff were very polite. Amicable ambience and. Finger-licking food ! Cheese cigars had these tender flavours ! Couldn’t capture their special dish Naan-pe-tang, it was amazing ! Will never forget the chicken tikka pizza with broadway special base <3",Positive
05/02/2019 11:29,Rated 5.0,18807262,Broadway,"15 Posts , 1551 Followers",69970310,Foodbite,"RATED  Hello Hyderabad! Today I want to share my experience with you regarding Broadway The Brewery. Broadway has a very large space located at Jubilee Hills. It is one of the largest restaurants and bars in Hyderabad made on the industrial lines with a variety of seating arrangement, live music, DJ nights, and it has the longest bar table in the city. ...Read full post on myfoodbite.com",Positive
04/02/2019 22:33,Rated 5.0,18807262,Broadway,"200 Reviews , 1089 Followers",14459641,Tarak,,Neutral
03/02/2019 18:44,Rated 4.0,18807262,Broadway,"74 Reviews , 739 Followers",1909694,Harish Kotra,"RATED  This place is huge! One of the best ambaince for a pub in Hyderabad. There are quite places and also loud places and it is spread across a wide area. As you walk in, you enter a huge amphitheatre modeled seating with an outdoor seating behind it.Don't miss going to this one. There may be restrictions on sandals, etc., but that's absolutely worth it. Food is too good! You just can't stop ordering for more. Try all of their starters, they are plated really well too and the quality and quantity makes your tummy full. Service is also pretty good and they make sure you are taken care of.",Positive
03/02/2019 09:33,Rated 5.0,18807262,Broadway,"33 Reviews , 60 Followers",34762095,Chandrakanth,"RATED  We hit this brewery cos it’s the newest of all breweries in Hyderabad. We had White Rabbit, Coriander Chicken, French Fries with Potato Wedges, Shrimps. Without music, this joint would’ve been incomplete. Tracks were way punchier. The ratings for this brewery are as follows:-Food: 5/5Service: 5/5Ambience: 5/5Value for money: 5/5",Neutral
01/02/2019 13:10,Rated 4.0,18807262,Broadway,"67 Reviews , 2332 Followers",35865851,Garlicperiperi,RATED  Not only the brewed beers but the food also had the best flavours in them. We went for the first time which was suggested by my friends. The ambience here is the main point where people do get attract best brewed beers 🍺 you would taste some . The food here is lip smacking . The service is good.,Positive
01/02/2019 02:53,Rated 5.0,18807262,Broadway,"71 Reviews , 1578 Followers",39803383,Neha Goud,,Positive
31/01/2019 23:32,Rated 5.0,18807262,Broadway,"29 Posts , 972 Followers",29112231,Food Khalifa,RATED  Hyderabad city has open-handed and welcomed the microbrewery and since then the city got many microbreweries open. With such more places in town but one name that I was hearing from the people and the buzz creator was Broadway. So my curiosity was high to visit this place and check out their amazing food menu and finally I am here. ...Read full post on foodkhalifablog.wordpress.com,Positive
31/01/2019 20:01,Rated 5.0,18807262,Broadway,"176 Reviews , 1258 Followers",16457299,Veerareddy Alekhya,,Positive
31/01/2019 18:53,Rated 4.0,18807262,Broadway,"83 Reviews , 196 Followers",888021,Vedant Killa,,Positive
31/01/2019 16:21,Rated 4.0,18807262,Broadway,"238 Reviews , 3209 Followers",33376100,_thefoodtrip_,,Positive
31/01/2019 15:16,Rated 5.0,18807262,Broadway,"31 Reviews , 98 Followers",37201775,Narsimha Reddy,RATED  A perfect place to hangout no words at all for describing ambiance I liked breweriesbest breweries so far in HyderabadFriendly service and quiet attentive,Positive
30/01/2019 02:42,Rated 5.0,18807262,Broadway,"106 Reviews , 488 Followers",38201383,Zubair Mohammed Iftekhar,,Positive
28/01/2019 14:27,Rated 5.0,18807262,Broadway,"32 Reviews , 1420 Followers",50311348,Wajahath Khan,,Neutral
28/01/2019 12:49,Rated 5.0,18807262,Broadway,"50 Reviews , 1115 Followers",33916626,Mohammed Asim Khan,,Neutral
27/01/2019 11:34,Rated 4.0,18807262,Broadway,"99 Reviews , 2735 Followers",48022357,Nom.Nom.Foodie (Ruthwikkumar Durgam),,Positive
25/01/2019 02:06,Rated 4.0,18807262,Broadway,"72 Reviews , 376 Followers",1518372,Hydfoodie,,Neutral
23/01/2019 22:42,Rated 5.0,18807262,Broadway,"121 Reviews , 1191 Followers",27925053,Mukul Poonia,"RATED  Great new brewery in town. First thing you will notice as you enter is how spacious it is. Naturally lit, great interiors. Then the server took an extra effort to let us know the beer styles being served. I appreciate that effort at a new brewpub. Food was great in quantity and quality. Every order passing by the table, you feel like ordering. Beer tastes good. We had a great time and now it will be my go to place for having some drinks with company. Plus the crowd was great here. And not to mention the dj playing psy trance. Loved it all. Thanks BW. Great job, well done.",Neutral
23/01/2019 11:14,Rated 4.0,18807262,Broadway,"37 Reviews , 95 Followers",32737713,Manaswini,,Neutral
23/01/2019 10:18,Rated 4.0,18807262,Broadway,"138 Reviews , 1452 Followers",15712950,Priya Bhandari(thefoodtinkerer),,Positive
23/01/2019 02:33,Rated 4.0,18807262,Broadway,"89 Reviews , 540 Followers",15714368,The Hungry Indians,,Neutral
21/01/2019 23:24,Rated 4.0,18807262,Broadway,"44 Posts , 3982 Followers",585547,Hyderabadfoodexplorer (sanchay Gumidelli),"RATED  Yet another Brewery in town. Broadway is one of the trendiest place in Hyderabad. Micro Breweries have become quite popular and the demand has created a niche to be filled up. The task has been taken over pretty quick and Hyderabad now houses a lot of micro breweries. Its not just one or two that have opened , also saying each and every place has their own distinct touch on the brews. Broadway is a latest entry. ...Read full post on hyderabadfoodexplorer.com",Positive
21/01/2019 10:44,Rated 4.5,18807262,Broadway,"135 Reviews , 3312 Followers",33536593,Rajat Goel ✳️,,Neutral
21/01/2019 10:40,Rated 4.0,18807262,Broadway,"156 Reviews , 477 Followers",1117879,Karandeep,,Neutral
21/01/2019 08:33,Rated 4.0,18807262,Broadway,"189 Reviews , 646 Followers",1233452,Kishan Mallik,RATED  I can call this place as brewery with brains ! Amazing brews and amazing food. Special mention to their fries & bheja fry pav. Place is happening and it's awesome to sit out and enjoy the music while chilling with set of friends,Positive
20/01/2019 17:20,Rated 5.0,18807262,Broadway,"29 Reviews , 1202 Followers",219504,Hungry Foodie,RATED  It's a perfect place to enjoy the weekend. awesome food and service 👌 Broadway's is the first place to get awesome beer. superb hospitality and many beer 🍻 options.Everything is awesome 👏Thumbs up!! Highly Recommended!!,Positive
19/01/2019 19:11,Rated 5.0,18807262,Broadway,"111 Reviews , 1207 Followers",41367194,Foodie,RATED  Broadway is one of the best breweries in the recent times. Ambiance is amazing and so is the food. Would definitely visit this place again and try other items as well,Positive
18/01/2019 01:34,Rated 5.0,18807262,Broadway,"481 Reviews , 1659 Followers",327798,Mohd Zubair Ali (Hyderabad.Food.Diaries),,Neutral
16/01/2019 22:50,Rated 4.0,18807262,Broadway,"124 Reviews , 585 Followers",1413357,Nishtha Arora,"RATED  I visited this due to the hope they created by having comedy socials here. The ambience is interesting catering to various crowds - the bar with dance floor, the outside sitting with lighter music 5/5I specially liked the stairs seating in ending with comfie cushions that gave a casual feel.The food-Strawberry fields salad-5/5Spanakopita cilantro pesto -4/5Moroccan chicken steak- could have been cooked better as was overcooked and meat was not juicy 3/5Broadway sidecar- very light drink but refreshingI wish they had ghevar with ice cream which was on menu but not availableThe menu is interesting and it's definitely a place I will come with an indecisive crowd of what to eat.the servers should be more careful of bringing the correct items. My experience would have been perfect had they been more attentive",Positive
12/01/2019 04:02,Rated 4.0,18807262,Broadway,"65 Reviews , 123 Followers",676999,Siddarth Mamidipalli,"RATED  I haven't visited much of rocking places in Hyderabad, but yeah you can say this looks really cool and different amongst others that I have seen yet. Staff was generous and helpful, food taste was great. We had order prawns, galoti kebab, crispy veg and combo food all tasted good and had nice portion. The moktail I had ordered wasn't that great.",Positive
10/01/2019 21:17,Rated 1.0,18807262,Broadway,"42 Reviews , 110 Followers",62933,Satyen Rai,"RATED  Broadway seemed like a nice place to visit based on reviews, photos etc. Notice the past tense there? Well, it seemed like a nice place till we actually got there. We were not even allowed inside because apparently they have a very strict dress code. All of us were in semi formals as we went to the place straight from the work — so we were not exactly inappropriately dressed. The only thing missing were shoes. Some of us were wearing flip flops. We were asked to leave as we were not wearing shoes - or at least that is what we were told. Seems like people are being judged by their footwear there days! It’s a brewery — people go there to chill out. I found this behaviour to be highly unprofessional and downright insulting.Rest assured, I’ll not visit this place, nor will I ever recommend it to anyone.Recommendation: A strict NO!",Positive
09/01/2019 21:58,Rated 2.0,18807262,Broadway,"146 Reviews , 488 Followers",35404442,FoodDelicaciesHyderabad,"RATED  I visted this place on 1st jan.. and boy was it crowded. The restaurant is huge, it can accomodate 100-200 pax. I happen to visit this place during lunch time and wasn't expecting this much crowd.We managed to get the a table, ordered 2 starters and Pizza along with a Mocktail. The service was a lil slow but its understandable as the place was buzzing.The food was average and the pricing is on higher side.The reason for my low rating is because at the time of billing we noticed that they levy 10% service charge which I assumed it should be optional so I asked the staff to deduct it.And then the manager appeared stating the reason why they levy service charge as this is a new place etc. and gave us a dirty look when we asked is it mandatory the grudgingly deducted it.I didn't expect such a behaviour from the manager.Before visiting I was mesmerized with the ambiance in the pictures but now idk if its worth it.",Negative
08/01/2019 16:17,Rated 4.0,18807262,Broadway,"86 Reviews , 3576 Followers",10238631,Nikhil Gaddale,"RATED  It's a very cool place, mind-blowingly big, I loved the ambiance... You can enjoy the hard dj or relax at the corner of the restaurant ... Very amazing place for groups.....you can have great time.... While going I notice therz even the terrace table .....beer was good especially the White rabbit other beers were very light... .. I didn't like them.... Lil bit disappointed with the food chicken coriander was lil bit hard ..was expecting very soft Chicken ... chilly Cheese toast was good loved it....and all the magic was in the blueberry cheese cake..... Made my evening..... I'm going back to this place again..",Positive
08/01/2019 15:56,Rated 5.0,18807262,Broadway,"36 Reviews , 97 Followers",2472340,Dhara Sai Kumar,RATED  Food..4/5Ambience..5/5Value for money...5/5One of my most loved place after PRost the food here is too good .the place lacks some DJ&music The place is awesome with good interior &they hav a lovable outdoor seating for u r loved ones ..I m sure u can recollect u r loved memories💕😊,Positive
07/01/2019 13:58,Rated 5.0,18807262,Broadway,"179 Reviews , 1356 Followers",114164,Avin Seth,"RATED  Mindboggling brewery with an awesome brewed beer 🍻 and amazingly innovative and unique brewed flavours. The 1000ml mugs are one of an experience to have beer in 😉. The ambiance is unmatachble, its a huge brewery with open sitting area as well. The crowd is great full of energy and enthu. Guys one of the places u shud not skip in hyderabad is the Broadway Brewery.Cheers Rakshita Nath",Positive
28/11/2018 13:19,Rated 4.0,18807262,Broadway,,46383732,,,Neutral
28/11/2018 02:55,Rated 5.0,18807262,Broadway,,31535308,,,Neutral
27/11/2018 18:33,Rated 4.0,18807262,Broadway,,1057042,,,Neutral
26/11/2018 21:05,Rated 4.0,18807262,Broadway,,71442666,,,Neutral
26/11/2018 18:09,Rated 5.0,18807262,Broadway,,2284812,,,Neutral
26/11/2018 15:36,Rated 4.0,18807262,Broadway,,38886625,,,Neutral
25/11/2018 11:53,Rated 4.0,18807262,Broadway,,573349,,,Neutral
23/11/2018 19:19,Rated 5.0,18807262,Broadway,,32992055,,,Positive
20/11/2018 15:46,Rated 4.0,18807262,Broadway,,15671699,,,Neutral
20/11/2018 12:51,Rated 5.0,18807262,Broadway,,2988636,,,Neutral
19/11/2018 14:41,Rated 5.0,18807262,Broadway,,240917,,,Neutral
18/11/2018 20:54,Rated 3.0,18807262,Broadway,,3237507,,,Neutral
18/11/2018 11:15,Rated 4.0,18807262,Broadway,,1492495,,,Neutral
17/11/2018 03:37,Rated 1.0,18807262,Broadway,,129971,,,Neutral
16/11/2018 23:05,Rated 5.0,18807262,Broadway,,51334860,,,Neutral
16/11/2018 17:22,Rated 5.0,18807262,Broadway,,32748419,,,Neutral
16/11/2018 11:00,Rated 3.0,18807262,Broadway,,51205487,,,Neutral
15/11/2018 19:37,Rated 5.0,18807262,Broadway,,27651958,,,Neutral
15/11/2018 01:52,Rated 5.0,18807262,Broadway,,30208267,,,Neutral
14/11/2018 14:42,Rated 1.0,18807262,Broadway,,615948,,,Neutral
12/11/2018 20:49,Rated 5.0,18807262,Broadway,,8633451,,,Neutral
11/11/2018 13:02,Rated 5.0,18807262,Broadway,,31653704,,,Neutral
13/03/2019 01:13,Rated 5.0,18713145,Resign Sky Bar,"24 Reviews , 154 Followers",63962179,Hareesh Sasanapuri,"RATED  Nice chill out place . Good ambience. Cocktails were good and starters too. I tried crispy chicken chips , chicken salad and prawns . Really nice place to hangout",Positive
09/03/2019 13:29,Rated 5.0,18713145,Resign Sky Bar,"63 Reviews , 195 Followers",1887060,Chintan Doshi,,Neutral
04/03/2019 20:45,Rated 4.0,18713145,Resign Sky Bar,"157 Reviews , 576 Followers",615948,Arun Tej,"RATED  Great place with nice ambiance. Beers are served chilled and can’t be better. However, the food wasn’t awesome hence 4. Will definitely visit again and see if they’ve improved.",Positive
26/02/2019 14:56,Rated 4.0,18713145,Resign Sky Bar,"135 Reviews , 541 Followers",1019396,DK,"RATED  Food - 4/5Ambience - 4/5Service - 4/5Value for money - 4/5Visited this bar where ambience is great and food is good.Tasted roasted mushroom fried with ghee which is soft and sweet ,french fries which were crispy and cripsy corn.",Neutral
25/02/2019 21:21,Rated 5.0,18713145,Resign Sky Bar,"57 Reviews , 227 Followers",31462233,Srujana A,RATED  So resign is a place located with a perfect view i was with my whole bunch of cousins and we had opted for open area which could accommodate 13 people almost and we had the time of our lives with excellent food and drinksFew starters were really mouth watering and going on very well with the drinks we ordered.The service was excellent and i like the friendly nature of the staff.The spacious area outside left us dancing with our shoes removed;) overall i would give 10/10For food and drinksFor serviceFor the DJ and value of money as well.,Positive
24/02/2019 19:29,Rated 4.0,18713145,Resign Sky Bar,"73 Reviews , 243 Followers",29610954,SudEep,"RATED  Went on a Friday night. Ambience was good. Opted outdoor seating which has nice view and was very peaceful. There was live music in the outdoor who sang the Bollywood mashups.Ordered chicken ghee roast , crispy lamb chips, Indonesian fish, kheema sambhar rice.Ghee roast chicken-4/5Crispy lamb chips-2/5. that was not according to my liking.Indonesian fish -3/5. This lacked some spice.Kheema sambhar rice- 5/5 just one word 'PERFECT'",Positive
21/02/2019 22:57,Rated 4.0,18713145,Resign Sky Bar,"24 Reviews , 41 Followers",35652306,Anam Hussain,RATED  Looking for a perfect place to hangout with? Looking for a sky view alongside a bar and good food? Resign definitely offers you an all in one experience.This place serves some amazing food . The thin crust pizza is something you should definitely give a try. This place offers an amazing ambience and the service is on point too.A must visit for everyone out there .,Positive
